{
    "name": "Generic_Airbase",
    "type": "Facility",
    "health": {
        "current_hp": 5000.0,
        "max_hp": 5000.0
    },
    "sensor": {
        "max_range": 100000.0,
        "fov_deg": 360.0
    },
    "has_data_link": true,
    "damage_model": {
        "hitboxes": [
            {
                "id": 0,
                "size": [
                    2000.0,
                    500.0,
                    10.0
                ],
                "armor": 0.0,
                "systems": [
                    "runway",
                    "fuel_depot"
                ]
            }
        ]
    }
}